{
  "schema_version": 4,
  "update_time": "2026-09-08 21:59:46",
  "market_policy": {
    "state": "DEFENSIVE",
    "score": -0.1932,
    "raw_score": -0.1932,
    "entry_permission": "MAINLINE_ONLY",
    "max_exposure_ratio": 0.7,
    "benchmark_weekly_score": -0.2044,
    "benchmark_natr_percentile": 20.83,
    "breadth_balance": -0.2308,
    "bull_count": 3,
    "bear_count": 9,
    "total_count": 26,
    "policy_pulse": "NONE",
    "policy_pulse_ret_1": -0.002158,
    "policy_pulse_ret_3": 0.000649,
    "policy_pulse_ret_5": -0.01281,
    "policy_pulse_ret_10": 0.001733,
    "policy_pulse_exposure_floor": 0.0,
    "data_manifest_approved": true,
    "exposure_ratchet_applied": false,
    "exposure_ratchet_pre_ratchet_max_exposure_ratio": 0.7,
    "exposure_ratchet_cooldown_remaining_days": 0,
    "factor_health_status": "SUSPENDED",
    "adaptive_factor_approved": false
  },
  "market_breadth": {
    "total": 26,
    "bull": 6,
    "bear": 13,
    "neutral": 7,
    "bull_pct": 23.1,
    "bear_pct": 50.0,
    "neutral_pct": 26.9,
    "ratio": 0.46,
    "signal": "偏空",
    "basis": "status_or_trend",
    "tone": "tone-down"
  },
  "signals": [
    {
      "schema_version": 4,
      "signal_id": "2026-09-08-513120-v4-20260821-bd76f481",
      "code": "513120",
      "name": "广发中证香港创新药(QDII-ETF)",
      "data_date": "2026-09-08",
      "price": 1.312,
      "data_quality": {
        "status": "VALID",
        "price_basis": "RAW",
        "analysis_basis": "QFQ",
        "adjustment_factor": 1.0,
        "adjustment_changed": false,
        "latest_adjustment_change_date": "",
        "reasons": []
      },
      "trend": {
        "state": "BULL",
        "monthly": {
          "score": 0.333911,
          "history_ok": true,
          "distance": 0.735562,
          "slope": -0.156996
        },
        "weekly": {
          "score": 0.383767,
          "history_ok": true,
          "distance": 0.499568,
          "slope": 0.141333,
          "efficiency": 0.537893
        },
        "history_ok": true
      },
      "entry": {
        "state": "WATCH",
        "setup": "PULLBACK",
        "setup_score": 54.53,
        "score": 54.53,
        "priority": 66.96,
        "channel": "PULLBACK",
        "reasons": [
          "MARKET_MAINLINE_ONLY"
        ]
      },
      "relative_strength": {
        "score": 80.96,
        "percentiles": {
          "20": 69.23,
          "60": 98.08,
          "120": 84.62
        },
        "beta": 0.7281,
        "has_120": true,
        "scope": "fixed_pool"
      },
      "risk": {
        "stop_loss": 1.26146173,
        "stop_dist_pct": 3.852,
        "atr_multiple": 1.3246,
        "quality": 56.77,
        "executable": true
      },
      "market_policy": {
        "state": "DEFENSIVE",
        "score": -0.1932,
        "raw_score": -0.1932,
        "entry_permission": "MAINLINE_ONLY",
        "max_exposure_ratio": 0.7,
        "benchmark_weekly_score": -0.2044,
        "benchmark_natr_percentile": 20.83,
        "breadth_balance": -0.2308,
        "bull_count": 3,
        "bear_count": 9,
        "total_count": 26,
        "policy_pulse": "NONE",
        "policy_pulse_ret_1": -0.002158,
        "policy_pulse_ret_3": 0.000649,
        "policy_pulse_ret_5": -0.01281,
        "policy_pulse_ret_10": 0.001733,
        "policy_pulse_exposure_floor": 0.0,
        "data_manifest_approved": true,
        "exposure_ratchet_applied": false,
        "exposure_ratchet_pre_ratchet_max_exposure_ratio": 0.7,
        "exposure_ratchet_cooldown_remaining_days": 0,
        "factor_health_status": "SUSPENDED",
        "adaptive_factor_approved": false
      },
      "calibration": {
        "early_stop_probability_3d": 0.176597,
        "win_probability_10d": 0.447639,
        "expected_excess_return_10d": 0.00270062,
        "sample_count": 5508,
        "confidence": "HIGH",
        "version": "v4-20260821-bd76f481",
        "approved": true,
        "status_reason": "APPROVED"
      }
    },
    {
      "schema_version": 4,
      "signal_id": "2026-09-08-512800-v4-20260821-bd76f481",
      "code": "512800",
      "name": "华宝中证银行ETF",
      "data_date": "2026-09-08",
      "price": 0.839,
      "data_quality": {
        "status": "VALID",
        "price_basis": "RAW",
        "analysis_basis": "QFQ",
        "adjustment_factor": 1.0,
        "adjustment_changed": true,
        "latest_adjustment_change_date": "2025-07-07",
        "reasons": [
          "ADJUSTMENT_FACTOR_CHANGED"
        ]
      },
      "trend": {
        "state": "BULL",
        "monthly": {
          "score": 0.310026,
          "history_ok": true,
          "distance": 0.448699,
          "slope": 0.140536
        },
        "weekly": {
          "score": 0.369289,
          "history_ok": true,
          "distance": 0.692791,
          "slope": 0.09891,
          "efficiency": 0.230216
        },
        "history_ok": true
      },
      "entry": {
        "state": "WATCH",
        "setup": "PULLBACK",
        "setup_score": 38.97,
        "score": 38.97,
        "priority": 66.76,
        "channel": "PULLBACK",
        "reasons": [
          "MARKET_MAINLINE_ONLY",
          "SETUP_NOT_CONFIRMED"
        ]
      },
      "relative_strength": {
        "score": 90.58,
        "percentiles": {
          "20": 98.08,
          "60": 84.62,
          "120": 80.77
        },
        "beta": -0.1589,
        "has_120": true,
        "scope": "fixed_pool"
      },
      "risk": {
        "stop_loss": 0.80779576,
        "stop_dist_pct": 3.7192,
        "atr_multiple": 2.4346,
        "quality": 75.02,
        "executable": true
      },
      "market_policy": {
        "state": "DEFENSIVE",
        "score": -0.1932,
        "raw_score": -0.1932,
        "entry_permission": "MAINLINE_ONLY",
        "max_exposure_ratio": 0.7,
        "benchmark_weekly_score": -0.2044,
        "benchmark_natr_percentile": 20.83,
        "breadth_balance": -0.2308,
        "bull_count": 3,
        "bear_count": 9,
        "total_count": 26,
        "policy_pulse": "NONE",
        "policy_pulse_ret_1": -0.002158,
        "policy_pulse_ret_3": 0.000649,
        "policy_pulse_ret_5": -0.01281,
        "policy_pulse_ret_10": 0.001733,
        "policy_pulse_exposure_floor": 0.0,
        "data_manifest_approved": true,
        "exposure_ratchet_applied": false,
        "exposure_ratchet_pre_ratchet_max_exposure_ratio": 0.7,
        "exposure_ratchet_cooldown_remaining_days": 0,
        "factor_health_status": "SUSPENDED",
        "adaptive_factor_approved": false
      },
      "calibration": {
        "early_stop_probability_3d": 0.115782,
        "win_probability_10d": 0.440463,
        "expected_excess_return_10d": 0.00053705,
        "sample_count": 5508,
        "confidence": "HIGH",
        "version": "v4-20260821-bd76f481",
        "approved": true,
        "status_reason": "APPROVED"
      }
    },
    {
      "schema_version": 4,
      "signal_id": "2026-09-08-513090-v4-20260821-bd76f481",
      "code": "513090",
      "name": "易方达中证香港证券投资主题(港股通)ETF",
      "data_date": "2026-09-08",
      "price": 1.846,
      "data_quality": {
        "status": "VALID",
        "price_basis": "RAW",
        "analysis_basis": "QFQ",
        "adjustment_factor": 1.0,
        "adjustment_changed": false,
        "latest_adjustment_change_date": "",
        "reasons": []
      },
      "trend": {
        "state": "BULL",
        "monthly": {
          "score": 0.020495,
          "history_ok": true,
          "distance": 0.171689,
          "slope": -0.164298
        },
        "weekly": {
          "score": 0.251882,
          "history_ok": true,
          "distance": 0.324652,
          "slope": 0.033731,
          "efficiency": 0.44086
        },
        "history_ok": true
      },
      "entry": {
        "state": "WATCH",
        "setup": "NONE",
        "setup_score": 0.0,
        "score": 0.0,
        "priority": 46.57,
        "channel": "NORMAL",
        "reasons": [
          "MARKET_MAINLINE_ONLY",
          "SETUP_NOT_CONFIRMED",
          "PRIORITY_BELOW_THRESHOLD"
        ]
      },
      "relative_strength": {
        "score": 81.92,
        "percentiles": {
          "20": 80.77,
          "60": 92.31,
          "120": 69.23
        },
        "beta": 0.9535,
        "has_120": true,
        "scope": "fixed_pool"
      },
      "risk": {
        "stop_loss": 1.80269588,
        "stop_dist_pct": 2.3458,
        "atr_multiple": 1.2,
        "quality": 37.9,
        "executable": true
      },
      "market_policy": {
        "state": "DEFENSIVE",
        "score": -0.1932,
        "raw_score": -0.1932,
        "entry_permission": "MAINLINE_ONLY",
        "max_exposure_ratio": 0.7,
        "benchmark_weekly_score": -0.2044,
        "benchmark_natr_percentile": 20.83,
        "breadth_balance": -0.2308,
        "bull_count": 3,
        "bear_count": 9,
        "total_count": 26,
        "policy_pulse": "NONE",
        "policy_pulse_ret_1": -0.002158,
        "policy_pulse_ret_3": 0.000649,
        "policy_pulse_ret_5": -0.01281,
        "policy_pulse_ret_10": 0.001733,
        "policy_pulse_exposure_floor": 0.0,
        "data_manifest_approved": true,
        "exposure_ratchet_applied": false,
        "exposure_ratchet_pre_ratchet_max_exposure_ratio": 0.7,
        "exposure_ratchet_cooldown_remaining_days": 0,
        "factor_health_status": "SUSPENDED",
        "adaptive_factor_approved": false
      },
      "calibration": {
        "early_stop_probability_3d": 0.108875,
        "win_probability_10d": 0.485526,
        "expected_excess_return_10d": 0.00069842,
        "sample_count": 5508,
        "confidence": "HIGH",
        "version": "v4-20260821-bd76f481",
        "approved": true,
        "status_reason": "APPROVED"
      }
    },
    {
      "schema_version": 4,
      "signal_id": "2026-09-08-515220-v4-20260821-bd76f481",
      "code": "515220",
      "name": "国泰中证煤炭ETF",
      "data_date": "2026-09-08",
      "price": 1.302,